date,session,word,meaning,synonym_1,synonym_2,sentence_1,sentence_2
21-04-2021,1,necromancy,(n) black magic; talking to deceased,sorcery,witchcraft,When Muskan died Utkarsh went to the psychic who claimed she can do necromancy,-
21-04-2021,1,froward,(adj) stubbornly disobedient,obstinate,-,The teacher had to send the froward kid to the Principal Office,-
21-04-2021,1,desiccate,(v) dry completely,dried,dehydrated,The dry winds of the desert have completely desiccated the animal bodies,-
21-04-2021,1,atavism,(n) the tendency to revert back to ancient or ancestral,reverting,turnabout,The modern politicians regard nationalism as tribal atavism,-
21-04-2021,1,castigation,(n) punishment; criticism,chastisement,-,Most British writers loathe the castigation from their schools,-
21-04-2021,1,ameliorate,(v) to improve,enhance,-,"Knowing COVID could not be contained, authorities tried to ameliorate its effects",-
21-04-2021,1,confound,(v) cause surprise or confusion; mix up,baffle,perplex,The inflation confounded the economic analysts,-
21-04-2021,1,errant,(adj) mistaken; straying from the proper path or standards,culpable,delinquent,The errant bowl of the bowler hit the head of the batsman,-
21-04-2021,1,avarice,(n) greed,cupidity,rapacity,He was rich beyond the dreams of avarice,-
21-04-2021,1,flora,(n) plants of a region or era,vegetation,-,Indian forests have a great flora,-
21-04-2021,1,consecrate,(v) declare sacred,sanctify,hallow,The Holy Trinity Church was consecrated in 1845,-
21-04-2021,1,deference,(n) respect; honor,regard,esteem,The proposal to pass Farm bills was turned down in deference to the objections of the farmers,-
21-04-2021,1,churlish,(adj) rude,discourteous,ungracious,The Knight cannot be churlish to the noble ladies,-
21-04-2021,1,ascetic,(adj) severe self discipline typically for religious reasons,austere,abstinent,The Muslim Sufi Saint lived a ascetic lifestyle,-
21-04-2021,1,preternatural,(adj) beyond normal or natural,supernatural,-,Autumn came with preternatural speed,-
21-04-2021,1,desuetude,(n) state of disuse,idleness,-,"After the storm, the sails of the ship were left in desuetude",-
21-04-2021,1,allay,(v) to reduce; diminish,assuage,alleviate,The stale burger allayed my hunger,-
21-04-2021,1,interregnum,(n) the interval between two office periods or continuous events,-,-,The interregnum between the discovery of radioactivity and its detailed study was long,-
21-04-2021,1,repine,(v) complain,fret,-,The coach asked the team not to repine on the lost opportunity,-
21-04-2021,1,emaciated,(adj) very weak and thin,skeletal,wasted,The prisoner was emaciated after getting only bread for three months,-
21-04-2021,2,ephemeral,(adj) short lived,fleeting,momentary,Fashions are ephimeral; the new ones come and the old ones go out,-
21-04-2021,2,antiquity,(n) ancient times; the quality of being ancient,hoariness,-,The town dates back to antiquity,The castle is of great antiquity
21-04-2021,2,adage,(n) a proverb expressing a general truth,aphorism,axiom,Tit for tat is an old adage,-
21-04-2021,2,cynical,(adj) believeing that people are motivated only by self interest; concerned only with the interests of oneself,-,-,He was brutally cynical and did not pay attention to the tears presented to him,-
21-04-2021,2,posit,(v) put forward as fact; put in position,postulate,propound,The Darwin Theory posits the need of evolution,The professor posited Maggie in the best poet categpry
21-04-2021,2,contention,(n) heated disagreement,dispute,discord,The captured territory became the reason of contention between India and Pakistan,-
21-04-2021,2,sedition,(n) behaviour that encourage rebellion,agitation,-,Prosecutor argued that the article published was an act of sedition as it was anti-government,-
21-04-2021,2,defunct,(adj) no longer existing or functioning,inoperative,-,The British Railway line is now in a defunct state and hence is shut down,-
21-04-2021,2,sedulous,(adj) showing dedication,diligent,meticulous,The watchman did his duty with sedulous care and hence prevented the robbery,-
21-04-2021,2,buttress,(v) to reinforce; to support,fortify,-,The suicide of students buttress the case of mental harassment by the school,-
21-04-2021,2,supersede,"(v) to replace, especially to displace an inferior or outdated",supplant,-,The old Ambassador Cars are superseded by new Ford Cars,-
21-04-2021,2,alleviate,(v) to ease; make less severe; improve partially,diminish,-,The new government policies were effective in increasing overall wealth but was unsuccessful in alleviating poverty,-
21-04-2021,2,flout,(v) openly disregard; mock,scorn,-,The army men have to face dangers if they flout the security protocols,-
21-04-2021,2,dismiss,(v) put away from consideration; reject,discharge,-,She dismissed the taxi and walked back home,-
21-04-2021,2,flux,(n) the process of flowing out,transfer,-,In some cultures time is considered as a flux moving in one direction,-
21-04-2021,2,qualm,"(n) an uneasy feeling of fear, worry and doubt",misgiving,-,The judge had no qualms about sending the thief to the prison,-
21-04-2021,2,stipulate,(v) to demand or specify (a requirement),set-down,-,Utkarsh stipulated certain conditions before his marriage,-
21-04-2021,2,recalcitrant,(adj) resisting authority or control,uncooperative,-,The officer had no choice but to court martial the recalcitrant soilder,-
21-04-2021,2,remonstrate,(v) to object or protest,expostulate,-,Minority committee members remostrated against the majority committee members against the bill,-
21-04-2021,2,gullible,(adj) easily persuaded to believe something; easily deceived,credulous,-,Gullible audience believed that the magic was real,-
22-04-2021,1,prodigal,(adj) spending money or using resources freely and recklessly,extravagant,spendthrift,Utkarsh warned his wife to stop her prodigal spending on makeup or they will go bankrupt,-
22-04-2021,1,adultrate,(v) to corrupt or to make impure,degrade,-,The milk tastes bad as it was adultrated with water,-
22-04-2021,1,idolatry,(n) idol worship,-,-,Idolatry was considered obstinate in British Era and hence the idols were busted,-
22-04-2021,1,contumacious,(adj) disobedient; rebellious,-,-,British tried to suppress the revolt of 1857 by capturing the cantumacious leaders,-
22-04-2021,1,distend,(v) to expand; swell,bloat,bulge,Kids affected with Kwashiorkor have distended bellies,-
22-04-2021,1,disparage,(v) to belittle; to represent as being of little worth,denigrate,-,Philosophy is the understanding of human mind and soul but is often desparaged with mind games,-
22-04-2021,1,causal,(adj) involving a cause,-,-,Plato considered there is a causal relationship between income inequality and political discontent,-
22-04-2021,1,cognizant,(adj) having knowledge or awareness,conscious,-,State government must be cognizant about the fact that it cannot make bills against the Center,-
22-04-2021,1,amenable,(adj) agreeable; open and responsive to suggestion,compliant,acquiescent,The young writer was amenable to suggestions from the club to improve his writing style,-
22-04-2021,1,reticent,(adj) not revealing his or her thoughts freely,reserved,introverted,Since Utkarsh was extremely reticent about his affair with his secretary the doubts of his wife increased,-
22-04-2021,1,aver,(adj) to affirm; declare to be true,assert,claim,He avered that he was innocent against all the allegations,-
22-04-2021,1,conundrum,(n) a confusing or difficult problem,quandry,-,The paradoxical story of I killed my grandfather presents us with a conundrum,-
22-04-2021,1,partisan,(n) committed to a party; one-sided; prejudiced,adherent,-,Public is extremely partison against the new government and hence is disliking every new policy,-
22-04-2021,1,amalgamate,(v) to combine into unified whole,integrate,-,Three states were amalgamated to form the new one,-
22-04-2021,1,frugality,(n) quality of being economical with money and food,thriftiness,-,"In these days of credit card, frugality is not practiced any more",-
22-04-2021,1,impute,"(v) represent (something, especially something undesirable) as being done or possessed by someone",attribute,ascribe,Primatologists generally impute relatively high intelligence of chimpanzees based on their ability to recognize themselves in a mirror,-
22-04-2021,1,desultory,(adj) random; lack of plan; disconnected,rambling,-,Jury had difficulty following the desultory testimony of the witness,-
22-04-2021,1,reprise,"(n) repitition, especially a piece of music",-,-,The standing ovation compelled the band to reprise their title song,-
22-04-2021,1,pellucid,(adj) translucently clear; easily understood,translucent,-,George Orwell had an amazingly pellucid style of writing which made him the bestselling author,-
22-04-2021,1,abeyance,(n) temporary suspension,-,-,A good judge must hold his judgement in abeyance until all facts have been presented,-
22-04-2021,2,affluence,(n) state of having great deal of money; wealth,prosperity,opulence,When they won the lottery their sudden affluence caused old friends to feel envy,-
22-04-2021,2,impetus,(n) force or energy with which a body moves,momentum,propulsion,Hit the booster before the flywheels lose all their impetus,-
22-04-2021,2,coerce,(v) persuade to do something by force or threats,pressurize,-,He was coerced to give evidence against his wife,-
22-04-2021,2,atrocious,(adj) horrifyingly wicked,barbaric,brutal,Child marriage is an attrocious act against the innocent children,-
22-04-2021,2,partake,(v) to eat or drink; join in,consume,-,After a hard day he partook his well deserved drink,Visitors can also partake in the Golf Tournament
22-04-2021,2,delineated,(v) to represent or depict,portray,-,Principal of Uncertainity was delineated by Hiesenberg,-
22-04-2021,2,behemoth,(n) huge creature,colossal,gigantic,The private sector is becoming commercial behemoth and outperforming the public sector,-
22-04-2021,2,caustic,(adj) sarcastic in a bitter way; burning,biting ,mordant,The caustic comments of the journalist on the government did not leave with him any friends among government officials,-
22-04-2021,2,mendacious,(adj) dishonest,deceitful,-,The judge ruled out the testimony as it was mendacious,-
22-04-2021,2,cataclysm,(n) violent disruption that causes destruction and change,catestrophe,-,The Chernobyl Incident was a cataclysm whose effects are still visible today,-
22-04-2021,2,juxtapose,(v) place side by side for contrasting effects,-,-,The black and white photos were juxtaposed with the coloured ones to delineate the evolution of photography,-
22-04-2021,2,foment,(v) to arouse or stir up,instigate,provoke,The celebrity accused media of fomenting hatred against her in the public,-
22-04-2021,2,carping,(v) to find fault; complain,grumble,-,Despite the carping of the critics the young players played well in the match,-
22-04-2021,2,sordid,(adj) corrupt; dirty,contemptible,filthy,Rajiv Gandhi Murder Scandal was one of the most sordid affairs in the Indian history,-
22-04-2021,2,demographic,(adj) relating to population basics,-,-,Demographic trends suggest that India will the young powered country in the future,-
22-04-2021,2,avocation,(n) minor or secondary occupation,-,-,Dan is so proficient in his avocation - computer programming - that he is thinking to quit his teaching job,-
22-04-2021,2,egotistical,(adj) excessively self centered,conceited,-,Critics accused the writer of being egotistical since she only wrote about herself,-
22-04-2021,2,renege,(v) go back on a promise or a contract (break it),-,-,If one party reneges on the contract they have to provide compensation to the other party,-
22-04-2021,2,circuitous,(adj) roundabout,winding,meandering,"In Hindu mythology, souls take a circuitous path to reach God",-
22-04-2021,2,debauchery,"(n) corruption; excessive indulgence in sex, alcohol or drugs",dissipation,-,The prince lived a life of debauchery until he found the spiritual dimension of his life,-
23-04-2021,1,reproach,(v) to find fauth with; blame,rebuke,reproval,Utkarsh reproaches his wife for his failed physical love life,-
23-04-2021,1,ornithologist,(n) scientist who studies birds,-,-,Salim Ali the famous ornithologist is often called the Birdman of India,-
23-04-2021,1,complacent,(adj) self satisfied,smug,-,Even though Tom received good grades in term 1 the professor warned him not to be complacent as term 2 would be difficult,-
23-04-2021,1,hirsuit,(adj) covered with hair,hairy,shaggy,Anil Kapoor has the most hirsuit chest in entire bollywood,-
23-04-2021,1,gerrymander,(v) manipulate boundaries (of electoral constituency) in order to favor one party,-,-,An argument against gerrymander is that it makes it difficult for party not in power to win elections,-
23-04-2021,1,libertine,(n) one without moral constraint,philanderer,-,John was a typical libertine and did any act that gave him pleasure without thinking twice,-
23-04-2021,1,deterrent,(n) something that discourages or hinders,disincentive,damper,"During the cold war, US maintained a large number of nuclear weapons as a deterrent to aggressive USSR",-
23-04-2021,1,florid,(adj) having a red or flushed face,ruddy,rosy,As she grew older she started to miss the florid face she had in her youth,-
23-04-2021,1,abate,(v) to reduce; decrease,subside,-,NASA postponed the launch till the radiations from solar flare are abated,-
23-04-2021,1,aesthetic,(adj) relating to beauty or art,ornamental,elegant,UX designer requires one to have an aesthetic mind,-
23-04-2021,1,extrinsic,(adj) coming and operating from outside; not inherent,extraneous,-,The experiment is conducted in an isolated environment to exclude factors that are extrinsic to the phenomenon,-
23-04-2021,1,prevaricate,(v) to evade the truth,quibble,beat about the bush,Modi Ji seemed to prevaricate when asked about the lack of medical oxygen in the country,-
23-04-2021,1,ingenuous,(adj) innocent and unsuspective,naïve,-,The conman could not take advantage of the ingeneous boy,-
23-04-2021,1,cacophonous,(adj) unpleasant or harsh sounding,blaring,-,The modern pop music though appreciated by many is regarded as a cacophonous by the older generation,-
23-04-2021,1,travesty,(n) a false absurd or distorted representation of something,parody,caricature,The playwright complained that the musical comedy based on his play was a travesty of his work,-
23-04-2021,1,abysmal,(adj) extremely bad,appaling,dreadful,For a bestselling author the content of her latest book was of abysmal quality and hence is extremely criticised,-
23-04-2021,1,lustrous,(adj) shining,glossy,satiny,Gold is used in jewellery as it is a lustrous material,-
23-04-2021,1,penchant,(n) inclination; strong liking to do something,preference,-,Sue has a penchant for science while her brother is more interested in arts,-
23-04-2021,1,prehensile,(adj) (chiefly of the limbs and tails of animals) capable of grasping,-,-,Monkeys have long prehensile tails which help to climb trees faster,-
23-04-2021,1,clairvoyant,(n) one who can predict future,psychic,fortune teller,Churches in 19th century burned alive the women who claimed to be clairvoyant,-
23-04-2021,2,surmise,(n) suppose something is true without having evidence to confirm it,guess,conjecture,I surmised that he is the culprit and hence neglected the obvious facts,-
23-04-2021,2,lackadaisical,(adj) lacking enthusiasm and determination,-,-,A lackadaisical defence made the team lose the match even after having the best players,-
23-04-2021,2,astringent,(adj) harsh; severe (especially for skin tissues),acerbic,-,Bob tends to nick himself when he shaves so he has to use an astringent aftershave to stop the bleeding,-
23-04-2021,2,treatise,(n) an article treating a subject systematically,disquisition,-,The gist of the treatise by the philosopher is that reality is unknown to human mind,-
23-04-2021,2,fulminate,(v) to attack loudly; publically declare wrong or evil,denounce,-,The senator fulminated against the foreign countries meddling in the bussiness of America,-
23-04-2021,2,impassive,(adj) showing no emotion,expressionless,inscrutable,The interviewer sat with an impassive face the entire time to see if I can handle difficult clients,-
23-04-2021,2,fulsome,(adj) so excessive as to be disgusting,-,-,The actor was embarrassed by the fulsome praise he received after winning the award,-
23-04-2021,2,avuncular,(adj) kind and friendly towards a younger as less experienced person,benevolent,-,The avuncular manner of the manager made the team to excel as they were happy to work with him,-
23-04-2021,2,appropriate,(v) take (something) for ones own use usually without asking the owner,sieze,usurp,The invading army appropriated supplies from the houses of the local people,-
23-04-2021,2,collage,(n) artistic collection of materials pasted on a surface; collection,-,-,She used many photographs to create a collage and gifted It to her boyfriend,-
23-04-2021,2,abdicate,(v) to give up a position right or power,resign,quit,Bahadur Shah Zafar was forced to abdicate his throne by the British,-
23-04-2021,2,asperity,(n) harshness in tone or manner,severity,acerbity,Even after being caught red handed she went to the police and said with some asperity that she has to call her lawyer,-
23-04-2021,2,supine,(adj) lying face upwards,-,-,The captured robbery suspects were held supine on the floor,-
23-04-2021,2,asylum,(n) place of refuge or shelter,refuge,sanctuary,Rani Laxmibai seeked asylum from the King of Kalpi when she was being chased by the British,-
23-04-2021,2,erudite,(adj) learned; scholarly; having great knowledge,-,-,Einstein was one of the most erudite person who ever lived,-
23-04-2021,2,plasticity,(n) quality of being easily shaped or moulded,pliability,-,Psychologists are always amused by the plasticity of human mind,-
23-04-2021,2,esoteric,(adj) hard to understand; known only to a few,abstruce,obscure,In The Lost Symbol only the Secret Masons knew the esoteric powers of the pyramid,-
23-04-2021,2,seismic,(adj) relating to earthquakes,-,-,Study od seismic waves helps us to understand earth surface and its internal structure,-
23-04-2021,2,blandishment,(n) flattery,cajolery,caoaxing,Despite the blandishment by the salesman Donna did not buy the car,-
23-04-2021,2,distil,(v) extract the essential elements,refine,filter,You should distil the water before using it in car batteries,-
24-04-2021,1,libido,(n) sexual desire,passion,lust,Libido in males peak at the age of 18,-
24-04-2021,1,impinge,(v) advance over an area belonging to someone else,encroach,infringe,Chimpanzees from outside the group impringing upon the territory are often met with aggression,-
24-04-2021,1,detraction,(n) derogatory comment on the character of a person,disparagement,-,The writer responded in an email to the critics long list of detractions about the book,-
24-04-2021,1,negate,(v) to cancel out,nullify,invalidate,The poor treatment of the suspect by the police negated any goodwill they had built up among the population,-
24-04-2021,1,converge,(v) to approach; tend to meet,coincide,intersect,Although India and China are rivals in certain areas their interests converge,-
24-04-2021,1,aberrant,(adj) deviating from what is normal,deviant,anomolous,When the behaviour of a person becomes aberrant his friends must take him to the Doctor,-
24-04-2021,1,fusion,(adj) union followed by synthesis,blend,amalgamation,A hydrogen bomb requires tremendous heat the fusion reaction,-
24-04-2021,1,litany,(n) lengthy recitation; repititive chant,recitation,enumeration,Students listened intently to the litany of the grammatical errors committed by them from the teacher,-
24-04-2021,1,penury,(n) extreme poverty,impoverishment,-,The autobiography tells the story of the billionaires journey from penury to riches beyond his imagination,-
24-04-2021,1,essay,(v) attempt or try,venture,-,The dancer began working with Jazz a form she had not previously essayed,-
24-04-2021,1,convex,(adj) curved outward,bulging,protuberant,Hypermetropia is treated using a convex lens,-
24-04-2021,1,stolid,(adj) having or showing little emotion,impassive,phlegmatic,Behind the stolid appearance of the professor is a fun loving and gregorious character,-
24-04-2021,1,gregorious,(adj) fond of company; sociable,convivial,-,Human beings are the most gregarious creatures and are hence living in established societies,-
24-04-2021,1,inherent,(adj)  firmly established by nature or habit,intrinsic,inmate,Even for completely random systems an inherent order exists in the nature,-
24-04-2021,1,dormant,(adj) inactive,-,-,Some microbes can remain dormant in the host body for days and then activate suddenly,-
24-04-2021,1,belie,(v) give a false impression,misrepresent,contradict,Boxers childlike face belies the ferocity with which he attacks the opponent,-
24-04-2021,1,mnemonic,(adj) assisting memory,-,-,Mnemonics can be used to easily remember a periodic table,-
24-04-2021,1,affected,(adj) artificial and designed to impress,phony,pretentious,Too much emphasis on proper english leads to unnatural and affected speech,-
24-04-2021,1,fauna,(n) animals of a period or region,-,-,When humans introduce fauna from one habitat to another the ecological balance is disturbed,-
24-04-2021,1,Lilliputian,(adj) extremely small,miniature,-,Microbiologists study Lilliputian organisms,-
24-04-2021,2,imbibition,(n) absorption of one substance by another,ingestion,absorption,The imbibition of water through the membrane makes the cell to swell up,-
24-04-2021,2,lugubrious,(adj) looking and sounding sad and dismal,mournful,gloomy,His face looked lugubrious after he failed the examination,-
24-04-2021,2,lucubration,(n) writing or study,-,-,After ten years of lucubration his research paper was finally published,-
24-04-2021,2,magnanimous,"(adj) generous or forgiving, especially towards a rival or less powerful person",generous,charitable,Alexander The Great was magnanimous towards Porus after defeating him in the battle,-
24-04-2021,2,mettle,(n) ability of a person to cope up with difficulty,spirit,resilience,"After performing poorly in first half, the team showed their true mettle in the second half and won the match",-
24-04-2021,2,delectable,(adj) delicious; extremely attractive (in a humurous way),appetizing,mouth-watering,In a five star restaurant you expect nothing but a delectable dish,"In the trek, the group visited the delectable mountains which were soothing to the eyes"
24-04-2021,2,mercurial,(adj) sudden or unpredicatable change in mood or mind,temperamental,capricious,"Entering his teenage years, Vaibhav started experiencing quite mercurial moods",-
24-04-2021,2,supplant,(v) supersede or replace,displace,supersede,Small shops have been supplanted by online stores,-
24-04-2021,2,indefatigable,(adj) persisting tirelessly (or a person or their efforts),unwearied,untiring,Sunderlal Bahuguna was an indefatigable defender of the environment,-
24-04-2021,2,refractory,(adj) stubborn or unmanageable,obstinate,mulish,The refractory farmers prevented the farm bills to come into effect,-
24-04-2021,2,ubiquitous,(adj) present or found everywhere,omnipresent,-,The priest said that God is ubiquitous and the entire world is his home,-
24-04-2021,2,volubility,(n) quality of taking fluently and readily,talkativeness,loquacity,He recalls how impressed he was as a child by the volubility of his uncles marathon conversations,-
24-04-2021,2,accolade,(n) award or privilege granted as a special honour,honor,recognition,Because of its amazing services and customer centricity the hotel has received many accolades,-
24-04-2021,2,iconoclastic,(adj) criticizing cherished beliefs or institutions,sceptical,heretical,Books by Ayn Rand were extremely iconoclastic in her time as they mentioned woman liberty,-
24-04-2021,2,impugn,(v) dispute truth and validity; call into question,challenge,-,The husband impugned the capacity of his wife as a mother in order to get the custody of the child,-
24-04-2021,2,indigent,(adj) poor; needy,impecunious,destitute,Everyone donated a charity for the relief of the indigent artists,-
24-04-2021,2,indictment,(n) formal charge or accusation of a serious crime,-,-,The lawyer made an indictment for conspiracy against Laura,-
24-04-2021,2,prodigious,"(adj) remarkably great in extent, size or degree",enormous,colossal,Harshad Mehta earned a prodigious amount of money from the 1996 scam,-
24-04-2021,2,reprobate,(n) a morally unprincipled person,rogue,scoundrel,In Batman Bruce Wayne pretended to be a reprobate in public but in private he saved the world,-
24-04-2021,2,equivocation,(n) use of ambiguous language to conceal the truth,prevarication,-,The ministers speech was filled with equivocation and hence the public was doubtful about it,-
25-04-2021,1,clamor,"(n) loud and confused noise, especially of people shouting",tumult,uproar,Over past 12 years the voices clamoring for protection of oceans have increased dramatically,-
25-04-2021,1,futile,(adj) incapable of producing any fruitful results,ineffective,fruitless,To some people philosophy seems futile as it does not produce any tangible results,-
25-04-2021,1,alloy,(n) mixture of two or more metals,amalgam,blend,Brass is an alloy of copper and zinc,-
25-04-2021,1,beneficent,(adj) generous or doing good (of a person),benevolent,altruistic,Theologian discussed why a beneficent God allows bad things to happen with good people,-
25-04-2021,1,omnipotent,(adj) having unlimited power (of a deity),almighty,supreme,The omnipotent God can treat all worries,-
25-04-2021,1,estimable,(adj) admirable; worthy of great respect,-,-,Ramcharitmanas contains the study of the estimable figure of Lord Ram,-
25-04-2021,1,complaisant,(adj) willing to please others; overly polite,obliging,amenable,"Although France and Germany are close friends, neither will trust the other as a complaisant ally",-
25-04-2021,1,inveigle,(v) to win over by flattery,cajole,wheedle,Students inveigled their Professor to postpone the exam,-
