date,session,word,meaning,synonym_1,synonym_2,sentence_1,sentence_2
28-04-2021,2,paucity,(n) presence of something in only small and insufficient quantities; shortage,scarcity,dearth,The kingdom being under siege for months now had a paucity of food supplies,-
29-04-2021,1,archeology,(n) study of material evidence of past human,-,-,Carbon-14 dating is of great use in archeology,-
29-04-2021,1,apogee,(n) highest point in the development of something; point in an orbit most distant from the body being orbited,climax,culmination,The Ottoman Empire reached its apogee in 17th century when it controlled a territory running from Budapest to North Africa,-
29-04-2021,1,euphemism,(n) use of agreeable or inoffensive language in place of unpleasant or offensive language,substitution,-,Sleep came to be used as a euphemism for Death,-
29-04-2021,1,etymology,(n) origin and history of a word,derivation,-,The origin of word barbarian reflects the ethnocentrisim of the ancient Greeks; its etymology is that it comes from the Greek word barbaros meaning non-Greek,-
29-04-2021,1,glib,(adj) (of words or a speaker) fluent but insincere and shallow,slick,pat,Sharons parents were not satisfied by her glib explaination of why she failed in the exam,-
29-04-2021,1,endow,(v) provide with a quality ability or asset,furnish,equip,Hercules was endowed with tremendous physical strength,-
29-04-2021,1,flourish,(n) embellishment or ornamentation,-,-,The Sophists often gave interminable speeches full of rhetorical flourishes,-
29-04-2021,1,incorporate,(v) take in or contain (something) as part of a whole; include,combine,absorb,Great authors always tried to incorporate their life experience into their books,-
29-04-2021,1,trample,(v) tread on and crush; treat with contempt,stamp,disregard,The fence has been trampled down by the mob,The statesman ought not to trample upon the opinions of his Church advisors
29-04-2021,1,catalyst,(n) something causing change,-,-,The rumor of greasing catridges with cow fat acted as a catalyst for revolt of 1857,-
29-04-2021,1,canon,(n) an established principle; a group of literary works,principle,oeuvre,The biased selections violated the canons of equal opportunity,The Shakespere canon is very enlightening
29-04-2021,1,lull,(n) temporary interval of quite and lack of activity,respite,pause,For two days there had been a lull in the fighting,-
29-04-2021,1,discordant,(adj) not in true; disagreeing,incongruous,-,In a pluralistic society there exists a cacophony of discordant voices each shouting to be heard,-
29-04-2021,1,intractable,(adj) hard to control or deal with,unmanageable,ungovernable,General practitioners are equipped to deal with most psychosomatic disorders but in intractable cases a psychiatrist is consulted,-
29-04-2021,1,dread,(n) great fear,apprehension,-,The thought of returning to London filled her with dread,-
29-04-2021,1,elicit,"(v) evoke or draw out (reaction, answer or fact) from someone",extract,evoke,The cops tried to elicit the truth from her via a rigorous questioning session,-
29-04-2021,1,log,(n) official record of events during the voyage of ship; part of trunk of a tree,journal,bole,The Navy maintains a meticulus record of their day logging the details of each individual,Logs of wood were set on fire
29-04-2021,1,jocularity,(n) quality of being happy and liking to make jokes,-,-,Coach exchanged a few words of jocularity with the team to reduce their stress,-
29-04-2021,1,implacable,(adj) incapable of being pleased,unappeasable,-,Once an implacable foe of capatalism China now seems to embrace it ,-
29-04-2021,1,cloister,(v) to confine or shut up (especially in a convent or monastry),seclude,sequester,The writer cloistered herself in a country house to finish her novel,-
29-04-2021,2,convention,(n) a way in which something is usually done ,-,-,Coding conventions about linting is as important as fixing errors,-
29-04-2021,2,convivial,(adj) sociable; firendly,amiable,affable,One of the jobs of the ambassador is to provide a convivial atmosphere for diplomats to meet,-
29-04-2021,2,waggish,(adj) humorous in a playful mischievous manner,impish,roguish,In the show Friends Chandlers attitude was waggish,-
29-04-2021,2,spectrum,(n) band of colours produced when light passes through a prism; broad range of related ideas or objects,-,-,The political science course deals with the whole spectrum of political ideologies,-
29-04-2021,2,effete,(adj) depleted of vitality; ineffectual,over-refined,-,The effete humanity is the reason of increased atrocious actions,-
29-04-2021,2,motif,(n) decorative designs especially a repeated pattern forming; dominant or recurring idea in artistic work,-,-,Colourful hand painted motifs adorn the boats,Superstition is a recurring motif in the book
29-04-2021,2,labile,(adj) liable to change; easily altered,-,-,Blood Pressure in human beings to varying degrees is liable,-
29-04-2021,2,assuage,(v) to make (an unpleasant feeling) less intense,alleviate,soothe,I did what little I could to assuage my guilt,-
29-04-2021,2,vapid,(adj) dull; tasteless,insipid,-,To relax in the evening Professor likes to watch vapid comedy shows,-
29-04-2021,2,audacious,(adj) bold; daring,intrepid,unflinching,The German Army was famous for its audacious surprise attacks on the Allied Forces,-
29-04-2021,2,query,(v) to question,inquire,-,Your query will be entertained at the help desk,-
29-04-2021,2,tiff,(n) a petty quarrel especially between friends or lovers,squabble,-,What we all thought was a tiff led to the divorce Utkarsh,-
29-04-2021,2,immutable,(adj) unchangable,inflexible,unyielding,If humans colonize on mars it would inscribe our immutable thoughts and beliefs in a new environment,-
29-04-2021,2,felicitous,(adj) well chosen or suited to the circumstances,suitable,fitting,The Constitution of India starts with a felicitous phrase We the people of India…,-
29-04-2021,2,epistemology,(n) branch of philosophy that examines the nature of knowledge,-,-,A major question in epistemology is whether the mind can ever gain objective knowledge,-
29-04-2021,2,centripetal,(adj) moving or tending to move towards the center,-,-,The gravitational force acts as a centripetal force to keep moon in its orbit,-
29-04-2021,2,diatribe,(n) bitter verbal attack,tirade,harangue,The speaker launched his diatribe against what he called the evils of technology,-
29-04-2021,2,intransigence,(n) stubbornness; refusal to compromise,-,-,Each side in the negotiations accused the other of intransigence so talks broke down,-
29-04-2021,2,convulated,(adj) (especially an argument or story) extremely complex and difficult to follow; twisted,labyrinthine,-,Unraveling the convulated genetic code is one of the great achievements of modern science,-
29-04-2021,2,veracious,(adj) truthful; accurate,veritable,unerring,The witness testimony appeared veracious at first but under cross-examination several inconsistencies appeared,-
30-04-2021,1,commensurate,(adj) corresponding in size or degree; proportional,corresponding,equivalent,With the increase in fuel proces the cost of commodities increased commensurately,-
30-04-2021,1,forestall,(v) prevent or obstruct (an anticipated event or action) by taking advanced actions; delay,pre-empt,-,The government took steps to forestall an economic downturn,-
30-04-2021,1,cathartic,(adj) providing psychological relief through the open expression of strong emotions,purgative,-,Crying is the best cathartic release,-
30-04-2021,1,rubric,(n) a heading or a title on a document; a category; a set of instructions or rules,protocol,-,The data was so diverse that the Scientist had to design a new rubric to organize it,There is a rubric established to grade each essay
30-04-2021,1,plethora,(n) large or excessive amount of something,overabundance,superfluity,Because it deals with deaths and grieving the funeral business has produced a plethora of euphemism such as a slumber room,-
30-04-2021,1,squatter,(n) a person who unlawfully occupies an uninhabited building or unused land,-,-,The police helped in order to evict the squatters from the old school building,-
30-04-2021,1,primordial,(adj) original; existing from beginning,primeval,prehistoric,Polytheism is regarded to be devulved from primordial Monotheism,-
30-04-2021,1,feral,(adj) (especially of an animal) in a wild state especially after escape from captivity,untames,-,Feral dogs after domestication sometimes form a pack and are becoming a threat to humans,-
30-04-2021,1,explicate,(v) analyse and develop (an idea or principle) in detail,explain,-,A recent study tries to explicate the relationship between crime and economic forces,-
30-04-2021,1,lucre,(n) money especially when regarded as sordid,profits,-,Many religions regard the pursuit of lucre as a sin,-
30-04-2021,1,introspective,(adj) contemplating ones own thoughts and feelings,self-examining,brooding,Poems by Robert Frost are mostly introspective,-
30-04-2021,1,laud,(v) praise (a person or their achievements) highly,extol,hail,The King lauded the Knight as a great soldier,-
30-04-2021,1,impair,(v) to damage or weaken (especially a function),injure,diminish,Alcohol has been shown to seriously impair the functioning of the brain,-
30-04-2021,1,tremulous,(adj) shaking or quivering slightly,trembling,unsteady,Due to nervousness Barbaras voice was tremulous on stage,-
30-04-2021,1,innate,(adj) inborn; natural,inbred,congenital,Monica had innate capacity for organization,-
30-04-2021,1,verbose,(adj) using or expressed in more words than required,wordy,loquacious,A skillful editor cut 20% of words from verbose manuscript keeping the meaning intact,-
30-04-2021,1,euphoria,(n) a feeling of extreme happiness,excitement,-,There was euphoria in the Professors house after it was learned that she received the Nobel Prize,-
30-04-2021,1,vehemently,(adv) in a forceful passionate or intense manner; with great feeling,-,-,He vehemently denied any suggestion of improper conduct,-
30-04-2021,1,banter,(n) playful and friendly exchange of teasing remarks,repartee,ripostes,The Governor engaged in some banter with the reporters before getting into serious conversations,-
30-04-2021,1,inadvertently,(adv) without intention; carelessly,accidently,-,His name was inadvertently omitted from the list,-
30-04-2021,2,innocuous,(adj) harmless,safe,-,The bodyguard looks innocuous enough but under his jacket he holds lethal weapons,-
30-04-2021,2,incursion,(n) sudden invasion,-,-,At first Indians were not too concerned about the incursions of British Settlers but their anxiety grew later,-
30-04-2021,2,asunder,(adv) apart,-,-,Indian peninsula and the Islands of Sri Lanka are cut asunder by Palk Strait,-
30-04-2021,2,amulet,(n) ornament worn as a charm against evil spirits,talisman,totem,The use of amulets is really common in hindu culture,-
30-04-2021,2,supplicant,(n) one who asks humbly and earnestly,entreaty,appeal,The mother of the man sentenced to be executed appeared as a supplicant before the governor asking him to grant his son clemensy,-
30-04-2021,2,impervious,(adj) impossible to penetrate; incapable of being affected,impermeable,-,We were amazed how Laura could sit at the noisy party studying Chemistry impervious to the noise around her,-
30-04-2021,2,contrite,(adj) feeling or expressing remorse at the recognition that one has done wrong,remorseful,repantant,The convicted man did not seem to be at all contrite about his crime,-
30-04-2021,2,sentient,(adj) able to perceive or feel things,conscious,aware,Charles Darwin regarded many animals as being sentient and as having intelligence,-
30-04-2021,2,nettle,(v) irritate or annoy (someone),vex,irk,The ambiguous syllabus of the exam nettled the students,-
30-04-2021,2,spendthrift,(n) person who spends money recklessly,profligate,prodigal,A rich spendthrift never saves enough,-
30-04-2021,2,categorical,(adj) absolute; unambiguously explicit and direct,unconditional,-,Although gay-marriage was categorically banned by every religion in India the recent court judgement allows it,-
30-04-2021,2,sycophant,(n) a person who acts very attentively towards someone important in order to gain advantage,creep,crawler,We reported the sycophant following Emma to the Police,-
30-04-2021,2,trepidation,(n) a feeling of fear or anxiety about something that may happen,apprehension,dread,John tried to hide his trepidation when he proposed to Susie the girl he loved,-
30-04-2021,2,overweening,(adj) showing excessive confidence or pride,presumptuous,arrogant,Ancient greeks believed that overweening pride would eventually be punished by gods,-
30-04-2021,2,inane,(adj) lacking sense or meaning; silly,foolish,idiot,Do not badger people with inane questions,-
30-04-2021,2,compendium,(n) collection of brief concise but detailed information about a particular subject especially in a book,compilation,anthology,The AIESEC compendium puts forth all the governing rules of the body,-
30-04-2021,2,affinity,(n) fondness; liking; similarity,empathy,kinship,The female students in the class felt an affinity for ancient Greek Euripides because he was sympathetic with women,-
30-04-2021,2,proponent,(n) a person who advocates a theory proposal or course of action,advocate,promoter,He was a strong proponent of the LGBTQ rights,-
30-04-2021,2,accrue,(v) to accumulate; grow by additions,amass,accumulate,James has been accruing his bonuses for a lavish vacation,-
30-04-2021,2,dupe,(v) to deceive; trick,hoodwink,hoax,In friendship as well as love the mind is often duped by his heart,-
01-05-2021,1,presage,(v) to foretell; indicate in advanced,portend,augur,The work by Nostradamus presaged a ton of disasters of the modern world,-
01-05-2021,1,copious,(adj) abundant in supply or quantity,plentiful,-,The copious rainfall was welcomed by the farmers,-
01-05-2021,1,indiscernible,(adj) impossible to see or clearly distinguish,unnoticeable,imperceptible,An indiscernible figure shaped among the shadows,-
01-05-2021,1,goad,(v) provoke or annoy (someone) so as to simulate a reaction,to prod,badger,Goaded by his friends to try football Jeff went on to become a football star,-
01-05-2021,1,champion,(v) vigorously support or defend the cause of,advocate,espouse,Robinhood is famous for championing the underdogs of England,-
01-05-2021,1,tillage,(n) preparation of land for growing crops,-,-,Proper tillage is a non-negotiable for good quality crop,-
01-05-2021,1,coagulate,(v) (of a fluid especially blood) change to a solid or semi-solid state,congeal,clot,In humans blood begins to coagulate 20 sec after an injury is sustained,-
01-05-2021,1,homogeneous,(adj) composed of identical parts; uniform in composition,unvaried,consistent,Sugar and water forms a homogeneous mixture,-
01-05-2021,1,efficacy,(n) efficiency; effectiveness,-,-,A cardinal rule of medicine is that the efficacy of a medicine should be measured against its side-effects,-
01-05-2021,1,cadge,(v) ask for or obtain (something to which one is not strictly entitled),to beg,sponge,Poor old Uncle Thompson used to cadge some money for cigarretes from me,-
01-05-2021,1,inundate,(v) overwhelm (someone) with things or people to be dealt with; flood,overburden,deluge,James parents are inundated with the complaints against him from the neighbors,The Indonesian Islands may be the first to be inundated if sea level rises
01-05-2021,1,tyrannical,(adj) exercising power in a cruel or arbitrary way,dictatorial,oppressive,The movie Dictator is a comical example of tyrannical administration in action,-
01-05-2021,1,anachronism,(n) something out of proper time or period,-,-,Some experts regard the retirement age of 65 years as an anachronism at a time when people have longer life expectancies,-
01-05-2021,1,analgesic,(n) medication that reduces or eliminates pain,anodyne,palliviate,Aspirin is a powerful analgesic introduced in 1899,-
01-05-2021,1,phlegmatic,(adj) calm in temperament; stolid calm disposition,sluggish,-,This book can inspire a phlegmatic individual to adapt an enthusiastic nature,-
01-05-2021,1,stratified,(adj) arranged in layers,-,-,Graphite has a stratified structure of carbon sheets,-
01-05-2021,1,antecedent,(n) something that logically preceeds another,precursor,predecessor,Can you identify the antecendent that led to Janes breakdown?,-
01-05-2021,1,firmament,(n) sky,heaven,-,Stars were twinkling in the clear firmament,-
01-05-2021,1,pristine,(adj) in its original condition; unspoilt,untouched,uncorrupted,The banks sealed vault has kept the manuscript in pristine condition for 50 years,-
01-05-2021,1,bard,(n) poet,-,-,The great bards of english literature have all been masters in the technique of verse,-
01-05-2021,2,malinger,(v) pretend to be ill to skip work or duty,-,-,In order to discourage malingering company required the employees going on a sick leave to produce a doctors certificate,-
01-05-2021,2,incarnate,(adj) (especially of a deity or spirit) embodied in human form,-,-,People believe that Jesus Christ was God Incarnate,-
01-05-2021,2,ascribe,(v) regard something as being done due to (a cause),attribute,assign,The teacher ascribed Janes poor performance in the exam to her poor health,-
01-05-2021,2,boorish,(adj) rude; insensitive,coarse,uncouth,Bob apologized for his boorish behaviour saying he did not know it was such a formal occasion,-
01-05-2021,2,mollifying,(v) too soothe,emollient,appease,The Prime Minister tried to mollify people protesting the tax increase with a promise to raise revenue by other means,-
01-05-2021,2,arboreal,(adj) living in trees; relating to trees,-,-,Monkeys are arboreal animals,-
01-05-2021,2,austere,(adj) severe or strict in manner; having no comfort or luxuries,stern,ascetic,The retired general was an austere man with rough outlook to things,Conditions in prison could hardly be more austere
01-05-2021,2,exhort,(v) strongly encourage or urge (someone) to do something,enjoin,adjure,Adams friends exhorted him to play football,-
01-05-2021,2,egress,(n) the action of going out of or leaving a place,departure,exit,This is the only gate for entry and egress of passengers,-
01-05-2021,2,gossamer,"(adj) light and delicate, like cobwebs",sheer,-,NASA believes that they can construct a gigantic gossamer spacecraft in the space using light weight material,-
01-05-2021,2,monolithic,"(adj) solid and uniform; unified whole; large, powerful and indivisible",rigid,intractable,In the 15th century there was a significant movement to revitalise the Church from within however it had become so monolithic over the centuries that the reform was ineffective,-
01-05-2021,2,trope,(n) a figurative or metaphorical use of a word or expression (especially recurring),-,-,A car chase is a standard trope of the Hollywood film not the traffic jam,-
01-05-2021,2,analogous,(adj) comparable,similar,corresponding,The research postulates that the brain is analogous to a digital computer,-
01-05-2021,2,impecunious,(adj) having little or no worth,indigent,penurious,The biography tells us how he went from a impecunious student to a rich businessman,-
01-05-2021,2,bough,(n) main branch of a tree,-,-,The apple boughs are laden with blossoms,-
01-05-2021,2,equable,(adj) steady; unvarying,stable,serene,Throughout the crisis the President was equable,-
01-05-2021,2,garrulous,(adj) extremely talkative,loquacious,verbose,The garrulous houseguest made it difficult for us to get much work done in the project,-
01-05-2021,2,perturb,(v) to disturb greatly; make uneasy or anxious; cause an object to deviate from normal orbit,unsettle,-,The findings the violence is increasing in schools greatly perturbed government officials,Strong gravitational forces perturb small celestial bodies
01-05-2021,2,morose,(adj) sullen and ill tempered,sulky,gloomy,After her divorce Jessica was morose for days,-
01-05-2021,2,impede,(v) delay or prevent (something or someone) by obstructing them,hinder,-,The development of western China has been impeded by the lack of trained workers,-
02-05-2021,1,redoubtable,(adj) formidable; arousing fear; worthy of respect,awe-inspiring,fearsome,As a result of winning 95% of her cases the prosecutor has earned a reputation as a redoubtable attorney,-
02-05-2021,1,abstinence,(n) practice of restraining oneself from indulging in something usually alcohol or sex,sobriety,temperance,Bob started drinking again after six years of abstinence,-
02-05-2021,1,nurture,(v) care for and protect (someone or something) while they are growing,bring up,fostering,James was nurtured by his parents in a close knit family,-
02-05-2021,1,impermeable,(adj) impossible to penetrate,watertight,-,The antivirus software is said to be impermeable of malicious attacks from internet,-
02-05-2021,1,bawdy,(adj) dealing with sexual matters in a comical way; humorously indecent,obscene,ribald,He knew when to get slightly bawdy and was smart enough not to cross the line,-
02-05-2021,1,rudimentary,(adj) involving or limited to basic principles,elementary,introductory,Sonam Wangchuk received only rudimentary education,-
02-05-2021,1,sporadic,(adj) occuring at irregular intervals or only in a few places; scattered or isolated,irregular,infrequent,Despite the ceasefire there have been sporadic outbreaks of violence,-
02-05-2021,1,quibble,(v) to argue over insignificant and irrelevant details,-,-,The lawyers spent so much time quibbling over details that they made little progress in reaching an agreement on the central issue,-
02-05-2021,1,aggrandize,(v) to make larger or greater,-,-,One of the concerns of the farmers of the US constitution was that they made little progress in reaching an agreement on the central issue,-
02-05-2021,1,fervor,(n) intense and passionate feeling,ardour,vehemence,Soldiers were welcomed back to the US with fervor after end of WW2,-
02-05-2021,1,adament,(adj) refusing to be persuaded or to change ones mind,uncompromising,unyielding,Despite widespread opposition to the plan the Prime Minister is adamant to enforce demonetization,-
02-05-2021,1,gratification,(n) pleasure especially when gained from satisfaction of a desire,quenching,slake,A thirst for sexual gratification is one of the seven sins,-
02-05-2021,1,caste,(n) any of the hereditary social classes of Hindu society; social stratification,social-order,-,The dalits formerly knows as untouchables are at the bottom of the thousands of castes that make up Indian Society,-
02-05-2021,1,probity,(n) quality of having strong moral principles; honesty and decency,integrity,rectitude,No one questioned the probity of the judge being considered for the position of Chief Justice of India,-
02-05-2021,1,altruism,(n) disinterested and selfless concern for well being of others,selflessness,self-sacrifice,Some may choose to work with vulnerable elderly people out of altruism,-
02-05-2021,1,dissident,(n) a person who disagrees about beliefs (especially official policies),objector,protestor,Some of the most notorious concentration  camps in history were the Gulag camps to control dissidents,-
02-05-2021,1,perfunctory,(adj) (of an action) carried out without real interest or effort,superficial,-,The perfunctory inspection of the airplane failed to reveal the fault in the wings,-
02-05-2021,1,irrevocable,(adj) not able to be changed reversed or recovered,final,irremediable,The decision of the Dean to resticate her was irrevocable,-
02-05-2021,1,empirical,(adj) derived from obervation or experiment,observed,-,Farady provided enough empirical evidences to support his claim,-
02-05-2021,1,laconic,(adj) using very few words,concise,succinct,The laconic actor seemed to be a good choice to play the strong silent hero in the movie,-
02-05-2021,2,quiescent,(adj) in a state or period of inactivity or dormancy,passive,inert,The malignant tumor can stay quiescent for a o long time-,
02-05-2021,2,facetious,(adj) treating serious issues with deliberately inappropriate humor,flippant,glib,The comedians facetious comments about prominent politicians kept the audience amused,-
02-05-2021,2,provocative,(adj) causing anger or other strong reaction especially deliberately,infuriating,exasperating,Arnab is famous for giving provocative speeches on the news,-
02-05-2021,2,covetous,(adj) desiring something owned by others,grasping,insatiable,The astronomer of covetous about the time that his college gets for research on the Hubble Telescope,-
02-05-2021,2,elixir,(n) a substance believed to have the power to cure ills,concotion,tincture,The doctor said that the medicine will alleviate my pain but I should not believe it to be a elixir,-
02-05-2021,2,disdainful,(adj) showing contempt or lack of respect,scornful,contemptuous,After the argument he gave his parents a disdainful look,-
02-05-2021,2,autonomous,(adj) self-governing; independent,-,-,The State Government are autonomous and consist of their legislative assemblies,-
02-05-2021,2,decorum,(n) proper behaviour,decency,-,When addressing the nation the President generally has an air of decorum,-
02-05-2021,2,noxious,(adj) harmful poisonous or very unpleasant,toxic,virulent,They were overcome by the noxious fumes,-
02-05-2021,2,complement,(n) something the completes or makes up a whole,supplement,accompaniment,Good wine provides a perfect complement to fine food,-
02-05-2021,2,coquette,(n) a woman who flirts,-,-,After she had played the part of the coquette in the college play her boyfriend started having insecurities,-
02-05-2021,2,echelon,(n) a level or rank in the organization,rank ,grade,Elon Musk is now amongst the upper echelons of the business world,-
02-05-2021,2,plumb,(v) to determine the depth; to examine deeply,-,-,A person has to plumb the depths of dispair before finding the reality,-
02-05-2021,2,luminous,(adj) bright; glowing,shining,dazzling,The moon is the most luminous object in the night sky,-
02-05-2021,2,bestow,(v) confer or present (an honour right or gift),grant,vouchsafe,The country bestowed its highest medal on the war hero,-
