date,session,word,meaning,synonym_1,synonym_2,sentence_1,sentence_2
06-05-2021,2,exigency,(n) an urgent need or demand,-,-,Indian Medical Association was not prepared for the exigencies of insufficient oxygen supply,-
06-05-2021,2,geriatric,(adj) relating to old people especially with regard to their healthcare,-,-,The city has the best geriatric hospital in the state,-
06-05-2021,2,burgeon,(v) began to grow or increase rapidly,flourish,-,The rapid industrialisation and burgeoning world population resulted in such an increase in pollution,-
06-05-2021,2,menagerie,(n) a collection of wild animals kept in captivity for exhibition; diverse collection of people or things,-,-,Linda seems to take home every abandoned pets in town; she now has a menagerie of dogs cats turtles and other animals,-
06-05-2021,2,stringent,(adj) (of regulations requirements or conditions) strict precise and exacting,firm,rigorous,After the warning from the Mediac Experts stringent guidelines have been issued to control air pollution,-
06-05-2021,2,regale,(v) entertain or amuse (someone) with talk,fascinate,captivate,Bill Clinton often regaled visitors with his amazing anecdotes,-
06-05-2021,2,presumptuous,(adj) (of a  person or their behaviour) failing to observe the limits of what is appropriate; rude,brazen,egotistical,The new employee did not offer her advice to her boss because she was afraid he might consider it presumptuous,-
06-05-2021,2,imperious,(adj) arrogant and domineering,peremptory,imperial,The spoil rich kid had some imperious demands,-
06-05-2021,2,distrait,(adj) distracted or absent minded,inattentive,preoccupied,The chairperson became distrait because his secretary was not sitting at her usual place,-
06-05-2021,2,derivative,(n) something based on another source,unoriginal,-,Morphine - a great analgesic - is the principal derivative of opium,-
06-05-2021,2,veriest,(adj) used to emphasize the degree to which a description applies to someone or something,-,-,He had spoken the very truth and transformed it into the veriest falsehood,-
06-05-2021,2,plutocracy,(n) society ruled by the rich,-,-,It is argued the modern democracy is a plutocracy as their wealth makes them have a great influence on political decisions,-
06-05-2021,2,formidable,(adj) intimidating; threatening,menacing,frightening,By mid 19th century US had became a formidable military power,-
06-05-2021,2,exhilaration,(n) a feeling of happiness and excitement,elation,euphoria,The allies felt the exhilaration after winning the World War,-
06-05-2021,2,meretricious,(adj) apparently attractive but having no real value,gaudy,specious,One of the allures of jargon is that it can make something meretricious easier to accept because it is dressed in fancy language,-
06-05-2021,2,insuperable,(adj) (of a difficulty or obstacle) impossible to overcome,insurmountable,inconquerable,Development of antiballistic missiles have met with limited success because of almost imsuperable difficulties presented by the speed of approaching warhead that must be intercepted,-
07-05-2021,1,mesmerize,(v) capture the complete attention of (someone),transfix,spellbind,The audience sta mesmerized listening to retired soldiers story,-
07-05-2021,1,relegate,(v) assign an inferior rank or position to ,downgrade,-,The National Organization for Woman aim to prevent women from being relegated to a secondary role,-
07-05-2021,1,Bildungsroman,(n) a novel dealing with ones formative years or spiritual education,-,-,This book is a bildungsroman of sorts as Tull overcomes his abused childhood and learns about love,-
07-05-2021,1,exacerbate,(v) make (a problem bad situation or negative feeling) worse,to aggravate,-,Excessive Carbon Dioxide release from vehicles has exacerbated the Greenhouse Effect on the planet,-
07-05-2021,1,forswear,(v) agree to give up or to do without,renounce,repudiate,When she became a US citizen Julia forswear allegiance to all other countries and pledged to defend the US,-
07-05-2021,1,defeatism,(n) an attitude of accepting expecting or being resigned to defeat,-,-,It is important for a sportsman to work his best till the last moment and not resort to defeatism,-
07-05-2021,1,ruse,(n) an action intended to deceive; a trick,stratagem,subterfuge,Being annoyed of his presemce Emma tried to think of a ruse to get Paul out of the house,-
07-05-2021,1,diffuse,(v) spread over a wide area or between a large number of people,disperse,scatter,The idea of equality and liberty diffused through the society after the French Revolution,-
07-05-2021,1,pervade,(v) (especially of a smell) spread through and be perceived in every part of,permeate,suffuse,A smell of stale cabbage pervaded the air,-
07-05-2021,1,inure,(v) accustom (someone) to something  especially something unpleasant,harden,toughen,After 20 years in the army the chaplain had become inured to the sight of men dying on the battlefield,-
07-05-2021,1,fallow,(adj) (of farmland) ploughed and harrowed but left for a period without being sown in order to restore its fertility or to avoid surplus production,uncultivated,unsown,At the beginning of each school year the teacher looks out at the new students and thinks of a fallow field ready to be cultivated,-
07-05-2021,,pragmatic,(adj) dealing with things sensibly and realistically in a way that is based on practical rather than theoretical considerations,practical,realistic,The cult of romantic love was a major factor in making marriage for love rather than for more pragmatic reasons,-
07-05-2021,1,approbation,(n) approval or praise,encouragement,endorsement,The ParamVir Chakra is the highest approbation on Indian Soldier can receive,-
07-05-2021,1,mundane,(adj) lacking interest or excitement; of this earthly world rather than a heavenly or spiritual one,humdrum,temporal,The mundane description of the event bored me too much,It is said that the spirits of the dead can act upon the mundane world
07-05-2021,1,metamorphosis,(n) change; transformation,mutation,-,In recent years India has been undergoing metamorphosis transforming itself from agra-based to industry-based economy,
07-05-2021,1,agrarian,(adj) relating to cultivated land or cultivation of land,agricultural,-,Brazil is rapidly diversifying ots agrarian economy,-
07-05-2021,1,invective,(n) verbal abuse,vituperation,insults,The debate judge cautioned the participants not to engage in invectives,-
07-05-2021,1,deleterious,(adj) causing harm or damage,detrimental,injurious,Divorces are assumed to have deleterious effects on children,-
07-05-2021,1,callous,(adj) showing or having an insensitive and cruel disregard for others,heartless,cold-hearted,Jims terrible experiences in war have made him callous about the suffering of others,-
07-05-2021,1,rail,(v) to scold with bitter or abusive langauge,-,-,The critic of globalization railed against its effects on the poor people of the world,-
07-05-2021,2,nexus,(n) a connection or series of connections linking two or more things,-,-,Wall Street is the nexus of American Financial System,-
07-05-2021,2,Elysian,(adj) relating to or characteristics of heaven,blissful,paradisal,According to the myth he started having Elysian visions days before his death,-
07-05-2021,2,pugnacious,(adj) eager or quick to argue quarrel or fight,aggressive,belligerent,His public statements became increasingly pugnacious,-
07-05-2021,2,burnish,(v) polish (something especially metal) by rubbing,brighten,-,Poet T S Eliot burnished his reputation as one of the master poets of 20th century with his amazing works,-
07-05-2021,2,nonplussed,(adj) so surprised that one is unaware hoe to react,bewildered,bemused,The members of the football team were nonplussed by the presence of a female reporter in the locker room,-
07-05-2021,2,belligerant,(adj) hostile and aggressive,threatening,pugnacious,Because of the poor performance Boss mood was belligerant in the meeting,-
07-05-2021,2,encomium,(n) a formal expression of praise,accolade,eulogy,The PM asked his speechwriter to compose an encomium for the retiring general,-
07-05-2021,2,metaphysics,(n) branch of philosophy that examines the nature of reality,-,-,To skeptics metaphysics is an arbitrary search for a chemical truth,-
07-05-2021,2,conjure,(v) cause (a spirit or a ghost) to appear by means of a magical ritual,-,-,They hoped to conjure up the spirit of their dead son,-
07-05-2021,2,founder,(v) (of a ship) fill with water and sink; (of a plan) breakdown or fail,submerge,-,The ship foundered in the storm,Most attempts to create advanced new technology by government fat founder because of difficulty in anticipating changes in the world ogf technology
07-05-2021,2,albatross,(adj) something that causes great deep concern or anxiety,-,-,Fame has become an albatross around her neck,-
07-05-2021,2,alacrity,(n) cheerful willingness,eagerness,readiness,Coach was pleased to see the team get to work on the tas of improving its tackling skills with alacrity,-
07-05-2021,2,calumny,(n) making false and defamatory accusation about someone in order to damage their reputation,slander,denigration,Calumny is best answered by silence,-
07-05-2021,2,spar,(v) making motions of boxing without landing heavy blows; argue with someone without hostility,-,-,One contestant broke his nose in the ring while sparring,Mother and daughter spar regularly over drink drugs and career
07-05-2021,2,sage,(adj) profoundly wise,learned,-,Samuel gave this sage advice to the young writers to always read your compositions,-
07-05-2021,2,apprise,(v) inform or tell someone,notify,-,I thought it is right to apprise Dorothy about the death of her son,-
07-05-2021,2,existential,(adj) having to do with existence,-,-,Existential questions about God still exist,-
07-05-2021,2,parry,(v) ward off (a weapon or attack) with a countermove; answer (a question or accusation) evasively,deflect,dodge,He parried the blow by holding his sword vertical,He parried questions from reporters outside the building
07-05-2021,2,arduous,(adj) extremely difficult,laborious,onerous,The task of writing a research paper is arduous but if it is broken into logical steps it becomes less daunting,-
07-05-2021,2,permeable,(adj) penetrable,pervious,porous,Wetsuits used by divers are permeable to water but are designed to retain body temperature,-
08-05-2021,1,digression,(n) a temporary departure from the main subject in speech or writing,detour,-,The novel about crimes and criminals contains fascinating digressions from the main story to discuss about philosophy of human desire,-
08-05-2021,1,problematic,(adj) posing a problem,troublesome,-,The idea of universe originating at a certain point in time seems problematic to many critics,-
08-05-2021,1,diverge,(v) go in different directions from the same point,disunite,divide,They were close friends in college but after graduation their lives diverged,-
08-05-2021,1,abjure,(v) solemnly denounce (a belief cause or claim),reject,forswear,Most members of Religious Society of Friends abjure the use of violence to settle disputer between nations,-
08-05-2021,1,propitiate,(v) to win over by appeasing (someone),placate,-,Pagans thought it was important to propitiate Gods via sacrifices,-
08-05-2021,1,meteorological,(adj) concerned with the weather,-,-,The Aeronauts is a movie revolving around meteorological discoveries,-
08-05-2021,1,tractable,(adj) easy to control or influence,yielding,amenable,The leader observed that people became more tractable when they see a grave danger arriving only he can solve,-
08-05-2021,1,inchoate,(adj) just began so not fully developed,redimentary,-,The process of moving literary works from inchoate state to finished state requires a lot of dedication,-
08-05-2021,1,expiate,(v) make amends or reparation for (guilt or wrongdoing),-,-,The devotees took a bath in holy Ganga river to expiate their sins,-
08-05-2021,1,cant,(n) hypocritical talk typically of moral religious or political nature; language pertaining to a certain group regarded with disparagement,sanctimony,jargon,He had no time to listen to the cant of the priest about his sins,These talks are computer geeks cant
08-05-2021,1,fetid,(adj) smelling extremely unpleasant,stinking,malodorous,Many people find the smell of curd fetid,-
08-05-2021,1,discredit,(v) harm someones good reputation,disgrace,dishonour,The attempts of the candidate to discredit his opponent by spreading damaging rumors about him failed,-
08-05-2021,1,fetter,(v) restrain with chains or menacles typically around ankles,confile,shackle,It is said that each person creates mind forged menacles fettering his natural instincts and spirit,-
08-05-2021,1,lascivious,(adj) lustful,libidinuos,lacherous,The court censored the movie as it was promiting lascivious thoughts,-
08-05-2021,1,expository,(adj) to explain or interpret,explanatory,descriptive,The literature exam required the students to create an expository model of an unseen part of poetry,-
08-05-2021,1,fracas,(n) a loud quarrel,brawl,scuffle,The police were called to break up a fracas that had erupted in the bar,-
08-05-2021,1,argot,(n) a jargon used by a group,cant,patois,Writers of crime fiction often use the argot of criminals and detectives to give a realistic atmosphere,-
08-05-2021,1,petulant,(adj) rude; bad tempered (especially childish),peevish,pettish,The boys father worried that his disobedient and petulant child would grow into an annoying adult,-
08-05-2021,1,fractious,(typically of children) irritable and quarrelsome,grumpy,grouchy,To unify his divided party the leader decided to first pacify the partys most fractious elements,-
08-05-2021,1,rarefied,(adj) (of air especially high altitude) of lower pressure than usual; thin; distant from lives and concerns of ordinary people; esoteric,refined,cliquish,Every ounce carried counts triple when you are walking uhill in rarefied air,Many scholars flourish in the rarefied atmosphere of IITs
10-05-2021,1,divest,(v) to deprive someone of (power rights or possession),strip,rob,For teaching his son the value of money he divested him of his allowances,-
10-05-2021,1,endemic,(adj) (of a disease or condition) regularly found among particular people or in a certain area,-,-,Malaria once endemic to the area has now been largely eradicated,-
10-05-2021,1,phoenix,(n) mythical immortal bird that lives for 500 years burns itself to death and rises from its ashes; anything that restored after great destruction,-,-,The captain believed that the battalion had been destroyed by the enemy but was amazed to see it arise phoenix-like its men still fighting valiantly,-
10-05-2021,1,rationale,(n) a set of reasons or a logical basis for a course of action or belief,reasoning,sense,He explained the rationale behind the sudden change in plan,-
10-05-2021,1,physiognomy,(n) a persons facial features or expressions,countenance,profile,The art teacher asked his students to make drawings of people with wide variety of physiognomy,-
10-05-2021,1,fatuous,(adj) silly and pointless,nonsensical,foolish,No one could understand the fatuous comments of Rhea,-
10-05-2021,1,nostalgia,(n) sentimental longing for a past time,reminiscence,-,The products marketing is centered around the nostalgia for 1920s,-
10-05-2021,1,porous,(adj) full of holes; permeable to liquids,pervious,penetrable,If you go camping ensure to have a tent with a roof that is not porous,-
10-05-2021,1,salacious,(adj) lustful,lascivious,obscene,The school board decided that the book is too salacious for the school library,-
10-05-2021,1,piety,(n) quality of being religious or reverent,devoutness,-,Shabri is revered for her piety for Lord Ram,-
10-05-2021,1,fresco,(n) painting done on plaster,-,-,The settings of the novel of Dan Brown often have ceilings with frescos on them,-
10-05-2021,1,transgression,(n) act that goes against the law,offense,crime,The teacher said she would not countenance any transgression in the classroom,-
10-05-2021,1,enervate,(v) to weaken,exhaust,weary,During World War 2 Russians counted on bitter cold to enervate German Soldiers,-
10-05-2021,1,vexation,(n) the state of being annoyed frustrated or worried,irritation,exasperation,Some people can live happily despite lifes inevitable vexation,-
10-05-2021,1,piquant,(adj) appealingly stimulating; pleasantly pungent,-,-,Many of the guests enjoy the piquant barbecue sauce but others found it too spicy,-
10-05-2021,1,sextant,(n) navigation tool that determines longitude and latitude,-,-,A sextant was an essential tool for the sailors in 18th century,-
10-05-2021,1,grandiloquent,(adj) pompous and extravagant in language style or manner especially to impress,bombastic,ostentatious,The orator abandoned grandiloquent phrases and instead uses simple and direct language,-
10-05-2021,1,nostrum,(n) medicine or remedy of doubtful effectiveness (especially because prepared by unqualified person),-,-,Although there are many nostrum for weight loss but the only effective one is exercises,-
10-05-2021,1,lassitude,(n) lethargy,weariness,sluggish,After the death of his wife Joseph spent three months in lassitude and depression,-
10-05-2021,1,irresolute,(adj) unsure of how to act; uncertain,indecisive,hesitant,The public despised Modi Ji saying that although the pandemic situation is difficult he must not be irresolute,-
10-05-2021,1,factotem,(n) a person (or employee) who performs all kinds of work,odd-job man,handyman,You must specialize in some field than working like a factotem,-
10-05-2021,1,intangible,(adj) not material; having no physical presence,impalpable,-,When choosing you career consider intangible rewards as well apart from financial ones,-
10-05-2021,1,propriety,(n) morals and behaviour conventionally considered to be correct,decorum,fitness,Judges are expected to conduct themselves with propriety especially in courtroom,-
10-05-2021,1,nugatory,(adj) of no value or importance,trifling,trivial,The historian can focus on information that looks nugatory but has great significance,-
10-05-2021,1,latent,(adj) present but hidden,concealed,-,Some scientists believe that human minds have latent powers,-
10-05-2021,1,eclectic,(adj) deriving ideas styles or tastes from diverse range of sources; selecting from various sources,-,-,Universities are offering an eclectic mix of courses for grad students,-
10-05-2021,1,lethargic,(adj) inactive and inert,sluggish,torpid,After an 18 hour flight the passenger were lethargic,-
10-05-2021,1,pique,(n; v) a feeling or irritation resulting from a hurt of ones pride; provoke or arouse,annoyance,stimulate,Sally left the restaurant in a fit of pique when her date cancelled the meeting,The geologists curiosity was piqued on the unusual appearance of the rock
10-05-2021,1,arrest,(v) to stop; to sieze,halt,apprehend,Temporary arrest of patients respiration helped in the surgery,The police arrested the accused
10-05-2021,1,viable,(adj) capable of working successfully,feasible,-,The proposed investiment in the risky share was economically viable because of the stable economy,-
10-05-2021,2,paean,(n) song of praise or thiumph,hymn,psalm,Fundamentally the poem is a paean of joy celebrating the coming of democracy in the country,-
10-05-2021,2,obdurate,(adj) stubborn,obstinate,intransigent,The teacher denied him to leave but the obdurate kid left anyway,-
10-05-2021,2,fraught,(adj) filled with or likely to result in (something undesirable),-,-,Releasing any new marketing campaign is fraught with danger,-
10-05-2021,2,meticulous,(adj) showing great attention to detail; very careful and precise,diligent,scrupulous,These designs are hand glazed with meticulous care,-
10-05-2021,2,shard,(n) piece of broken glass or pottery,fragment,chip,Shrads of glass flew in all directions,-
10-05-2021,2,sombre,(adj) dark or dull in colour or tone; feeling a deep seriousness and sadness,dingy,grave,The night sky was sombre and starless,Being offended he looked at him with a sombre expression
10-05-2021,2,inveigh,(v) to disapprove (in speech or writing) something with great hostility,fulminate,declaim,The conservative writer inveighed against the school boards decision to exclude moral education from curriculum,-
10-05-2021,2,vindictive,(adj) having a strong or unreasoning desire for revenge,vengeful,unforgiving,Treaty of Versailles after WW-I was deliberately vindictive imposing tremendous penalties on defeated nation,-
10-05-2021,2,ravage,(v) cause severe damage to,davastate,ruin,The hurricane ravaged the coasts of Tamil Nadu,-
10-05-2021,2,syllogism,(n) a form of deductive reasoning that has a major premise a minor premise and a conclusion,-,-,The following syllogism is often taught in schools If all Xs are Ys and all Ys are Zs then all Xs are Zs,-
10-05-2021,2,cantankerous,(adj) bad-tempered; argumentative and uncooperative,irascible,crotchety,Mr Kamenari was a cantankerous old man,-
10-05-2021,2,misnomer,(n) wrong or inaccurate name or designation,-,-,Morning Sickness is a misnomer since nausea can occur any time during the day,-
10-05-2021,2,mettlesome,(adj) full of spirit and courage; lively,gallant,gritty,The mettlesome young officer was well perceived by the seniors,-
10-05-2021,2,sylvan,(adj) related to the woods or forests,-,-,The houses sylvan settings provides the family with beauty,-
10-05-2021,2,engender,(v) cause or give rise to (a feeling situation or condition),-,-,The murder of Rajiv Gandhi engendered unrest in the global offices,-
10-05-2021,2,sidereal,(adj) with respect to distant stars,-,-,The sidereal year is longer than solar year by 20 minutes,-
10-05-2021,2,virtuoso,(n) someone with masterly skills; great musician,maestro,prodigy,Ravi Shanker was an Indian Sitar virtuoso,-
10-05-2021,2,avant-garde,(n) new and experimental ideas and methods in art music and literature,innovation,-,Newton was regarded as a promoter of avant-garde,-
10-05-2021,2,poseur,(n) a person who behaves affectedly to impress others,-,-,The critic labelled the author as poseur who is more interested in getting publics attention that in writing good books,-
10-05-2021,2,capricious,(adj) a sudden and unaccountable changes of mood and behaviour,fickle,mecurial,It is terrible to acknowledge that our lives depend upon a capricious boss,-
11-05-2021,1,extant,(adj) in existence; not lost,surviving,enduring,Unfortunately for Bible Scholars there are no extant writings of Jesus Christ,-
11-05-2021,1,paleontology,(n) study of past geological eras though fossil remains,-,-,In the show Friends Ross had a doctorate in Paleontology,-
11-05-2021,1,beget,(v) (especially of a man) being (a child) into existence by the process of reproduction; cause,father,engender,They hoped the King might beget an heir by his new queen,Killing begets more killings
11-05-2021,1,captious,(adj) tending to find fault or raise petty objections,fault-finding,critical,The captious professor seems incapable of appreciating the merits of even the most highly regarded project works,-
11-05-2021,1,enhance,(v) to increase or improve,intensify,magnify,His efforts to enhance his score in the exam went in vain,-
11-05-2021,1,incredulous,(adj) (of a person or their manner) unwill or unable to believe something,dubious,unbelieving,The brutality depicted in movies set in ancient ages seem rather incredulous to modern viewers,-
11-05-2021,1,tacit,(adj) understand or implied without being stated,implicit,hinted,During Cold War there was a tacit assumption on both ends that no one would launch an unprovoked nuclear attack,-
11-05-2021,1,itinerant,(adj) travelling from place to place,wandering,peripatetic,"According to state laws, companies hiring itinerant workers must provide them with housing",-
11-05-2021,1,polemic,(n) a strong verbal or written attack on someone or something,critical,virulent,Bal Gangadhar Tilaks polemic against the British via Kesari was effective,-
11-05-2021,1,frieze,(n) a broad horizontal band of sculpted or painted decoration especially on the wall near the ceiling,-,-,One of the best known friezes is done on the outer wall of the Parthenon in Athens,-
11-05-2021,1,extemporaneous,(adj) spoken or done without preparation,unrehearsed,impromptu,I enjoyed the speakers extemporaneous remark more than her prepared speech,-
11-05-2021,1,contingency,(n) a future event or circumstance which is possible but cannot be predicted with certainity,eventuality,-,A detailed contract must provide all possible contingencies,-
11-05-2021,1,abscission,(n) the act of cutting (especially the detachment of parts of living organisms like dried leaves of plant),-,-,It is hypothesized that the premature leaf abscission is an adaptive plant response to herbivorous attack,-
11-05-2021,1,prate,(v) talk foolishly ot at tedious length about something,chatter,-,Jaiveers prate about AIESEC issues is becoming excessively annoying,-
11-05-2021,1,brouhaha,(n) a noisy and overexcited  reaction or response to something,-,-,A brouhaha erupted over her statement about the President,-
11-05-2021,1,harrowing,(adj) extremely distressing,terrifying,-,The biopic of Milkha Singh also represents a harrowing depiction of India-Pakistan separation,-
11-05-2021,1,entomology,(n) scientific study of insects,-,-,Considering there are 925000 species of insects entomology is a vast field of study,-
11-05-2021,1,annals,(n) a record or events year by year,archieves,chronicles,The sacrifice of Bhagat Singh went down the annals of Indian Independence Struggle history,-
11-05-2021,1,simian,(adj) relating to or affecting apes or monkeys,ape-like,-,Many people in the 19th century denied the evolutionary significance of simian characteristics of human being,-
11-05-2021,1,rebus,(n) puzzle in which pictures or symbols represent words,-,-,Egyptian writing uses the principle of rebus substituting picture for words,-
11-05-2021,1,raiment,(n) clothing,-,-,It took two hours to the handmaiden to help the Princess put on her splendid raiment for her coronation,-
